{
  "app_name": "resources",
  "package_name": "com.wte.view",
  "scan_timestamp": "2026-08-14T19:23:29Z",
  "patterns": [
    {
      "pattern_type": "pre_checked_consent",
      "evidence_file": "decompiled/whattoexpect/resources/res/layout/fragment_email_capture_stage_picker.xml",
      "confidence": "high",
      "description": "Found pre-checked checkbox with consent-related text"
    },
    {
      "pattern_type": "deceptive_button_order",
      "evidence_file": "decompiled/whattoexpect/resources/res/values/strings.xml",
      "confidence": "medium",
      "description": "Found affirmative action buttons without clear decline option"
    },
    {
      "pattern_type": "pressure_tactic",
      "evidence_file": "decompiled/whattoexpect/resources/res/values/strings.xml",
      "confidence": "low",
      "description": "Found urgency or scarcity language in app strings"
    }
  ],
  "summary": {
    "total_patterns": 3,
    "pattern_types_found": [
      "deceptive_button_order",
      "pre_checked_consent",
      "pressure_tactic"
    ]
  }
}
