{
  "app_name": "resources",
  "package_name": "com.hp.babyapp",
  "scan_timestamp": "2026-08-09T00:21:06Z",
  "patterns": [
    {
      "pattern_type": "hidden_consent_flow",
      "evidence_file": "/Users/dubs/Projects/baby-app-audit-sprint4/decompiled/baby-plus/resources/res/layout-v22/fragment_dailyblog_consent_expanded.xml",
      "confidence": "medium",
      "description": "Found very small WebView that may hide consent content"
    },
    {
      "pattern_type": "deceptive_button_order",
      "evidence_file": "/Users/dubs/Projects/baby-app-audit-sprint4/decompiled/baby-plus/resources/res/values/strings.xml",
      "confidence": "medium",
      "description": "Found affirmative action buttons without clear decline option"
    },
    {
      "pattern_type": "pressure_tactic",
      "evidence_file": "/Users/dubs/Projects/baby-app-audit-sprint4/decompiled/baby-plus/resources/res/values-ru/strings.xml",
      "confidence": "low",
      "description": "Found urgency or scarcity language in app strings"
    }
  ],
  "summary": {
    "total_patterns": 3,
    "pattern_types_found": [
      "deceptive_button_order",
      "hidden_consent_flow",
      "pressure_tactic"
    ]
  }
}
