{
  "app_name": "resources",
  "package_name": "com.angry.shark.studio.nurturelock",
  "scan_timestamp": "2026-08-07T15:05:43Z",
  "patterns": [
    {
      "pattern_type": "deceptive_button_order",
      "evidence_file": "/Users/dubs/Projects/baby-app-audit-sprint4/decompiled/nurture-lock/resources/res/values-en-rCA/strings.xml",
      "confidence": "medium",
      "description": "Found affirmative action buttons without clear decline option"
    },
    {
      "pattern_type": "pressure_tactic",
      "evidence_file": "/Users/dubs/Projects/baby-app-audit-sprint4/decompiled/nurture-lock/resources/res/values-da/strings.xml",
      "confidence": "low",
      "description": "Found urgency or scarcity language in app strings"
    }
  ],
  "summary": {
    "total_patterns": 2,
    "pattern_types_found": [
      "deceptive_button_order",
      "pressure_tactic"
    ]
  }
}
