{
  "app_name": "resources",
  "package_name": "com.drillyapps.babydaybook",
  "scan_timestamp": "2026-08-09T00:20:27Z",
  "patterns": [
    {
      "pattern_type": "hidden_consent_flow",
      "evidence_file": "/Users/dubs/Projects/baby-app-audit-sprint4/decompiled/baby-daybook/resources/res/layout/browser_actions_context_menu_row.xml",
      "confidence": "medium",
      "description": "Found very small WebView that may hide consent content"
    },
    {
      "pattern_type": "deceptive_button_order",
      "evidence_file": "/Users/dubs/Projects/baby-app-audit-sprint4/decompiled/baby-daybook/resources/res/values/strings.xml",
      "confidence": "medium",
      "description": "Found affirmative action buttons without clear decline option"
    }
  ],
  "summary": {
    "total_patterns": 2,
    "pattern_types_found": [
      "deceptive_button_order",
      "hidden_consent_flow"
    ]
  }
}
