{
  "app_name": "resources",
  "package_name": "com.babycenter.pregnancytracker",
  "scan_timestamp": "2026-08-14T19:19:59Z",
  "patterns": [
    {
      "pattern_type": "pre_checked_consent",
      "evidence_file": "decompiled/babycenter/resources/res/layout/fragment_add_pregnancy.xml",
      "confidence": "high",
      "description": "Found pre-checked checkbox with consent-related text"
    },
    {
      "pattern_type": "hidden_consent_flow",
      "evidence_file": "decompiled/babycenter/resources/res/layout/activity_signup2.xml",
      "confidence": "medium",
      "description": "Found very small WebView that may hide consent content"
    },
    {
      "pattern_type": "deceptive_button_order",
      "evidence_file": "decompiled/babycenter/resources/res/values/strings.xml",
      "confidence": "medium",
      "description": "Found affirmative action buttons without clear decline option"
    },
    {
      "pattern_type": "pressure_tactic",
      "evidence_file": "decompiled/babycenter/resources/res/values/strings.xml",
      "confidence": "low",
      "description": "Found urgency or scarcity language in app strings"
    }
  ],
  "summary": {
    "total_patterns": 4,
    "pattern_types_found": [
      "deceptive_button_order",
      "hidden_consent_flow",
      "pre_checked_consent",
      "pressure_tactic"
    ]
  }
}
