{
  "app_name": "resources",
  "package_name": "com.nanit.baby",
  "scan_timestamp": "2026-08-14T19:22:34Z",
  "patterns": [
    {
      "pattern_type": "deceptive_button_order",
      "evidence_file": "decompiled/nanit/resources/res/values-ro/strings.xml",
      "confidence": "medium",
      "description": "Found affirmative action buttons without clear decline option"
    },
    {
      "pattern_type": "pressure_tactic",
      "evidence_file": "decompiled/nanit/resources/res/values/strings.xml",
      "confidence": "low",
      "description": "Found urgency or scarcity language in app strings"
    }
  ],
  "summary": {
    "total_patterns": 2,
    "pattern_types_found": [
      "deceptive_button_order",
      "pressure_tactic"
    ]
  }
}
